<?xml version="1.0" encoding="UTF-8" ?>
<!DOCTYPE eSearchResult PUBLIC "-//NLM//DTD esearch 20060628//EN" "https://eutils.ncbi.nlm.nih.gov/eutils/dtd/20060628/esearch.dtd">
<eSearchResult><Count>1018</Count><RetMax>20</RetMax><RetStart>0</RetStart><IdList>
<Id>3069587804</Id>
<Id>3069587774</Id>
<Id>3069587771</Id>
<Id>3069587741</Id>
<Id>3069402178</Id>
<Id>3069218576</Id>
<Id>2737963026</Id>
<Id>2586967820</Id>
<Id>2274792564</Id>
<Id>2274792563</Id>
<Id>2274792562</Id>
<Id>2274792561</Id>
<Id>2274792560</Id>
<Id>2274792559</Id>
<Id>2274792558</Id>
<Id>2274792557</Id>
<Id>2274792556</Id>
<Id>2274792555</Id>
<Id>2274792554</Id>
<Id>2274792553</Id>
</IdList><TranslationSet/><TranslationStack>   <TermSet>    <Term>biomol trna[prop]</Term>    <Field>prop</Field>    <Count>1</Count>    <Explode>N</Explode>   </TermSet>   <OP>GROUP</OP>  </TranslationStack><QueryTranslation>biomol trna[prop]</QueryTranslation></eSearchResult>
