<?xml version="1.0" encoding="UTF-8"?>
<!DOCTYPE eSearchResult PUBLIC "-//NLM//DTD esearch 20060628//EN" "http://eutils.ncbi.nlm.nih.gov/eutils/dtd/20060628/esearch.dtd">
<eSearchResult><Count>2</Count><RetMax>2</RetMax><RetStart>0</RetStart><QueryKey>19</QueryKey><WebEnv>NCID_1_214573425_130.14.18.34_9001_1448030770_1520095147_0MetA0_S_MegaStore_F_1</WebEnv><IdList>
<Id>48526533</Id>
<Id>22347799</Id>
</IdList><TranslationSet/><TranslationStack>   <OP>GROUP</OP>  </TranslationStack><QueryTranslation>#2</QueryTranslation></eSearchResult>
